{
  "artifact": "hwm:RenovationPlanningTermMappingAudit",
  "version": "0.1.0",
  "status": "mapping_candidate",
  "normative_language": "en",
  "sources": [
    {
      "source_id": "rdf11",
      "title": "RDF 1.1 Concepts and Abstract Syntax — RDF Datasets",
      "url": "https://www.w3.org/TR/rdf11-concepts/#section-dataset",
      "version_or_date": "W3C Recommendation 2014-02-25",
      "maturity": "W3C Recommendation"
    },
    {
      "source_id": "prov-o",
      "title": "PROV-O: The PROV Ontology",
      "url": "https://www.w3.org/TR/prov-o/",
      "version_or_date": "W3C Recommendation 2013-04-30",
      "maturity": "W3C Recommendation"
    },
    {
      "source_id": "schema30",
      "title": "Schema.org ChooseAction, Recommendation, and BuyAction",
      "url": "https://schema.org/ChooseAction",
      "version_or_date": "Development vocabulary v30.0, 2026-03-19",
      "maturity": "Community vocabulary; Recommendation is in the new area"
    },
    {
      "source_id": "dcmi",
      "title": "DCMI Metadata Terms — replaces",
      "url": "https://www.dublincore.org/specifications/dublin-core/dcmi-terms/terms/replaces/",
      "version_or_date": "DCMI Metadata Terms, accessed 2026-07-18",
      "maturity": "DCMI term"
    },
    {
      "source_id": "earl10",
      "title": "Evaluation and Report Language 1.0 Schema",
      "url": "https://www.w3.org/TR/EARL10-Schema/",
      "version_or_date": "W3C Working Group Note 2017-02-02",
      "maturity": "W3C Working Group Note; insufficient implementations for Recommendation"
    },
    {
      "source_id": "saref411",
      "title": "SAREF Core 4.1.1",
      "url": "https://saref.etsi.org/core/v4.1.1/",
      "version_or_date": "ETSI TS 103 264 V4.1.1, published 2024-10-31",
      "maturity": "ETSI Technical Specification"
    },
    {
      "source_id": "ifc432-placement",
      "title": "IFC 4.3.2.0 IfcLocalPlacement",
      "url": "https://standards.buildingsmart.org/IFC/RELEASE/IFC4_3/HTML/lexical/IfcLocalPlacement.htm",
      "version_or_date": "IFC4X3_ADD2 official",
      "maturity": "buildingSMART official specification"
    },
    {
      "source_id": "ifc432-circuit",
      "title": "IFC 4.3.2.0 IfcDistributionCircuit",
      "url": "https://standards.buildingsmart.org/IFC/RELEASE/IFC4_3/HTML/lexical/IfcDistributionCircuit.htm",
      "version_or_date": "IFC4X3_ADD2 official",
      "maturity": "buildingSMART official specification; entity is not in a standardized schema subset"
    },
    {
      "source_id": "iso81346-10",
      "title": "ISO 81346-10 — Power supply systems",
      "url": "https://www.iso.org/standard/75471.html",
      "version_or_date": "ISO 81346-10:2022; official public abstract accessed 2026-07-19",
      "maturity": "International Standard; ISO stage 90.92 to be revised"
    },
    {
      "source_id": "iso81346-101",
      "title": "ISO/TS 81346-101 — Modelling concepts, guidelines and requirements for power supply systems",
      "url": "https://www.iso.org/standard/81285.html",
      "version_or_date": "ISO/TS 81346-101:2025; official public abstract accessed 2026-07-19",
      "maturity": "ISO Technical Specification; stage 90.92 to be revised"
    },
    {
      "source_id": "iec60364-1",
      "title": "IEC 60364-1 — Fundamental principles, assessment of general characteristics, and definitions",
      "url": "https://webstore.iec.ch/en/publication/63699",
      "version_or_date": "IEC 60364-1:2025; official public scope accessed 2026-07-19",
      "maturity": "IEC International Standard; safety standard"
    },
    {
      "source_id": "iec60364-4-43",
      "title": "IEC 60364-4-43 — Protection against overcurrent",
      "url": "https://webstore.iec.ch/en/publication/28432",
      "version_or_date": "IEC 60364-4-43:2023; official public scope accessed 2026-07-19",
      "maturity": "IEC International Standard; safety standard"
    },
    {
      "source_id": "iec60364-5-52",
      "title": "IEC 60364-5-52 — Wiring systems",
      "url": "https://webstore.iec.ch/en/publication/1878",
      "version_or_date": "IEC 60364-5-52:2009+AMD1:2024 CSV; official public scope accessed 2026-07-19",
      "maturity": "IEC International Standard; selection and erection of wiring systems"
    },
    {
      "source_id": "iec60364-6",
      "title": "IEC 60364-6 — Verification",
      "url": "https://webstore.iec.ch/en/publication/24656",
      "version_or_date": "IEC 60364-6:2016 including 2017 corrigendum; official public scope accessed 2026-07-19",
      "maturity": "IEC International Standard; initial and periodic verification; revision under development"
    },
    {
      "source_id": "iev826-design-current",
      "title": "IEC Electropedia area 826 — design current of an electric circuit",
      "url": "https://www.electropedia.org/iev/iev.nsf/index?openform=&part=826",
      "version_or_date": "IEV 826-11-10; official terminology index accessed 2026-07-19",
      "maturity": "IEC International Electrotechnical Vocabulary"
    },
    {
      "source_id": "iev826-ampacity",
      "title": "IEC Electropedia — current-carrying capacity",
      "url": "https://www.electropedia.org/iev/iev.nsf/display?ievref=826-11-13&openform=",
      "version_or_date": "IEV 826-11-13, publication date 2022-08",
      "maturity": "IEC International Electrotechnical Vocabulary"
    },
    {
      "source_id": "iev691-load-demand",
      "title": "IEC Electropedia — installed load and demand factor",
      "url": "https://www.electropedia.org/iev/iev.nsf/index?openform=&part=691",
      "version_or_date": "IEV 691-02-03 and 691-10-05; official terminology accessed 2026-07-19",
      "maturity": "IEC International Electrotechnical Vocabulary"
    },
    {
      "source_id": "odrl22",
      "title": "ODRL Information Model 2.2",
      "url": "https://www.w3.org/TR/odrl-model/",
      "version_or_date": "W3C Recommendation 2018-02-15",
      "maturity": "W3C Recommendation"
    },
    {
      "source_id": "xacml30",
      "title": "XACML 3.0 Core Specification",
      "url": "https://docs.oasis-open.org/xacml/3.0/xacml-3.0-core-spec-en.html",
      "version_or_date": "OASIS Standard 2013-01-22",
      "maturity": "OASIS Standard"
    }
  ],
  "terms": [
    {
      "term_id": "hwm-planning:DesignOption",
      "layer": "domain_role",
      "decision": "hwm_application_profile",
      "external_terms": [
        { "source_id": "prov-o", "term": "prov:Plan", "uri": "http://www.w3.org/ns/prov#Plan", "coverage": "strong_partial" },
        { "source_id": "prov-o", "term": "prov:wasRevisionOf / invalidatedAtTime", "uri": "http://www.w3.org/ns/prov#wasRevisionOf", "coverage": "strong_partial" },
        { "source_id": "schema30", "term": "schema:actionOption", "uri": "https://schema.org/actionOption", "coverage": "partial" }
      ],
      "residual_gap": "prov:Plan covers intended actions or steps toward goals; wasRevisionOf and invalidation preserve version lineage. They do not require exactly one base root, closed dependency resolution, explicit rebase, or regeneration of downstream simulation and evaluation outputs.",
      "normative_action": "retain_profile_constraint",
      "publication_rule": "Type a Design Option as prov:Plan; use prov:wasRevisionOf for a revised base or option and prov:invalidatedAtTime when an old entity becomes unusable. Do not publish a competing HWM ontology class or carry downstream outputs across revisions without regeneration.",
      "confidence": "high",
      "fixture_evidence": ["two-options-derived-from-one-base", "explicit-rebase-regenerates-output", "superseded-base-historical-only"]
    },
    {
      "term_id": "hwm-planning:candidateFor",
      "layer": "relationship",
      "decision": "hwm_application_profile",
      "external_terms": [
        { "source_id": "schema30", "term": "schema:actionOption", "uri": "https://schema.org/actionOption", "coverage": "partial" },
        { "source_id": "prov-o", "term": "prov:Plan", "uri": "http://www.w3.org/ns/prov#Plan", "coverage": "partial" }
      ],
      "residual_gap": "A Product Model under consideration and the IEC-bound function-position role are inputs to a planning context. That composition needs branch and lifecycle constraints, but it does not justify a globally reusable binary candidateFor predicate.",
      "normative_action": "retain_profile_constraint",
      "publication_rule": "Represent consideration inside a prov:Plan or a scoped ChooseAction and bind the function-position role through the lifecycle Profile. Keep hwm-planning:candidateFor only as a compatibility projection; never interpret it as installation, realization, ownership, compatibility proof, or household selection.",
      "confidence": "high",
      "fixture_evidence": ["candidate-model-not-installed-asset"]
    },
    {
      "term_id": "hwm-planning:mountingPlan",
      "layer": "relationship",
      "decision": "hwm_application_profile",
      "external_terms": [
        { "source_id": "prov-o", "term": "prov:Plan", "uri": "http://www.w3.org/ns/prov#Plan", "coverage": "strong_partial" },
        { "source_id": "ifc432-placement", "term": "IfcLocalPlacement", "uri": "https://standards.buildingsmart.org/IFC/RELEASE/IFC4_3/HTML/lexical/IfcLocalPlacement.htm", "coverage": "strong_partial" }
      ],
      "residual_gap": "IFC placement describes an occurrence of IfcProduct in a coordinate system; this fixture plans a Product Model before any occurrence exists. The Profile must preserve planned-versus-installed identity and bind the placement to a prov:Plan.",
      "normative_action": "retain_profile_constraint",
      "publication_rule": "Use prov:Plan plus an IFC/BOT-compatible placement artifact. Treat hwm-planning:mountingPlan as a compatibility projection, not a new geometry relation.",
      "confidence": "high",
      "fixture_evidence": ["planned-mounting-not-installed-location"]
    },
    {
      "term_id": "hwm-planning:reservedLoad",
      "layer": "relationship",